title,rating,review
Disgusting!,1.0,"I will eat anything - and I have a high tolerance for strange, new or unusual things. These ""biscotti"" tasted like ....I don't even know. I tried several different flavors and each one had a horrible flavor /aftertaste. They tasted like...mold, mildew, chemicals and I don't know what else. I literally could not swallow one single, small bite I took and had to spit them out in my hand. They are also like dust when you bite them. I kept choking on the dust for a while afterwards. They expiration date said 5/28/21. Yeah, right."
"Very, very BAD.",1.0,"The biscotti are too crumbly and tasted stale. The frosting tastes as if someone took a scoop of vegetable shortening and added food dye to make it appear as chocolate, but has no flavor to it. They were absolutely awful, and we couldn’t eat them. The presentation is lovely, though—just don’t eat them!!! Yuck."
Nothing like biscotti,1.0,"Very soft, crumbly cookie, with not much taste. They certainly did not look anything like the picture. Were melted, and had hardly any decoration on them. Have tasted much better cookies and would never order these for anyone. I got them as a gift and was very disappointed in their quality and appearance."
Bad biscottis,1.0,I am so upset I just got a call from my friend who received the biscottis and am very disappointed that they had to throw them away. They were horrible tasting and tasted old. They were tried by several people and everyone had the same response. Please if there is a way to make this up to my friend please do. This was a gift for a family who just lost their mother.
Not So Fresh,2.0,Ordered arrived and many of the pieces had a stale taste (Old).. Not recommended.
Very bland,2.0,"The best thing I can say is that they look nice. But they are lacking in any flavor. They appear to be covered in chocolate, but yet have no chocolate taste. The cookie itself is not a biscotti but rather a dense shortbread. Edible, but completely unsatisfying."
Don't buy! Yucky!,1.0,"Received these as a gift. Freshness date is 11/1/2020. These are beautiful! However, they are horrible to eat! The first bite coated my mouth with a film (shortening?) and the taste was nasty, and the nasty taste lingered. We tried a nibble of a few of these--as I said they looked so good--but the verdict was the same for all at our family gathering. We usually buy biscotti by Nonni--those are delicious and more affordable! Will stick with Nonni!"
the product was all rancid and very old. Not eatable.!!!,1.0,I purchased this for a birthday gift to a very close friend. She told me that all the biscottis were old and very rancid. She could not eat them and had to throw them away. I am very embarrassed and disappointed in this company. I would appreciate a refund to my account.
Horrible!,1.0,"We received this box of 24 as a gift. The box was beautiful. Presentation, beautiful. Taste - horrible is too kind a word. We could not tell what flavors were in the box so I randomly picked one. Took a tiny taste (because I didn't know what I was biting into) - to me, it tasted rancid. Very strongly rancid. My husband tried a different flavor. He thought it tasted strongly of soap. I took a tiny bite, it tasted the same as the first piece to me. I couldn't tell you why, but we decided to try one more piece - same thing."
A great gift for any occasion.,5.0,This was sent as a birthday gift & the recipient was very happy with the quality & freshness of the biscotti cookies.
Not impressed,2.0,Did not taste gourmet enough and quiet small.
Stale and Broken,1.0,"These arrived stale, broken and jammed into the bottom of a tight small white bubble envelope, instead of a more protective box! This was a gift for my wife's birthday and it was a disaster. I want my money back!"
Gone before there was time to share.,4.0,"They were a gift and arrived on time and my son ate thermal so quickly his wife didn't get a taste. I am not sure that is a wise move for a newly wed, but he said they were delicious."
Ok,2.0,Was just ok.
Granny perfect gift,5.0,"Bought this for the Great Grandmothers Birthday. My wife asked me why I bought these over getting her some chocolates. Not within 10 minutes did she get a thank you call saying, “ she couldn’t stop eating them and thank god we didn’t get her chocolates because it now upsets her stomach”. I just looked at her and said Mic Drop “Booooom” perfect old lady gift."
daughter sent as a gift,2.0,These looked beautiful but had no taste. Couldn't bring myself to tell daughter who sent it that they were awful....
Not Vegan - No returned allowed = out $40.00,1.0,NOT VEGAN - Bought because they were described as vegan on Amazon. Says no dairy and does say traces of egg but traces does not mean egg added. When my daughter received them it clearly stated eggs as an ingredient. No return policy left me out $40.00 for nothing.
Gift,5.0,This item was a good gift
Delicious and prompt delivery,5.0,Delicious
Disappointed and embarrassed,1.0,"I don't like giving negative reviews, but I ordered these for my Parent's anniversary because they love Biscotti. My Parent's called and thanked me for the cookies and were ready to enjoy however the cookies were very stale and expired. I was quite embarrassed. Paying $40 for treats they (the company) should be sure that the recipient is satisfied."
Arrived in poor condition,2.0,"This was a gift, and product arrived with biscotti in pieces and somewhat melted. Will never order this item again. Beware if you are giving a gift and want to avoid the embarrassment. My friend said that they tasted good although they arrived in poor condition."
Best Biscotti I’ve ever had!!,5.0,"I sent a box to my mother who is in an independent living facility. I haven’t been able to see her in person since the beginning of March. I thought these would be a fun pre-Thanksgiving gift she could share with her friends.

She called me this morning saying she was everyone’s best friend! She brought them to share at breakfast and they were a huge hit!! She couldn’t wait to tell me. “Best biscotti I’ve ever had” she said.

So thank you for making my 95 year old mother’s Day! Not to mention a table full of people at The Veradan in Edmond, Ok!

I’m ordering another few boxes for other family members now!!"
Really Disappointed,1.0,Bought this as a gift because it had so many GREAT reviews. Well I am giving a TRUTHFUL review. Save your money. Buy something else. They came broken. They came a day earlier than ordered. (Wanted them on my moms 94th birthday party). They looked awful. Dry All crumbs. Was so disappointed. I will never go by reviews again.
MADE MY SISTER'S DAY!!!!,5.0,"My sister had surgery and I wanted to send her something to ease her pain and make her happy. I had previously sent her a small box of the biscotti and she loved them. This time, I decided to send her a large box so she could share with her husband and when they arrived, it made her day!!!! She was so happy and the biscotti were so delicious, both my sis and her hubby were able to take a long, yummy break from her the pain of recovery. She immediately sent me a text telling me she had been having a bad day and my gift made her day! Seeing how happy she was, it made my day too. :-)"
Yuk,1.0,"Presentation was nice. But the flavor was disappointing. Didn’t taste like biscotti, and bordering on stale. Would not recommend and would not order again.
*revision: we really tried to like these but ended up throwing over half of them away. Definitely don’t recommend."
Delicious and Beautiful !,5.0,"Great! Sent this to my mom for Mother’s Day. I wanted to try something other than plain cookies or chocolate. My mom loved it and told us it tastes really good.
I was happy that none of them were broken also."
Biscotti Cookies,5.0,Bought these for Mother's Day and my mom couldn't say enough great things about them. She even had to hide them from herself so she wouldn't eat all of them in one sitting. She is going to buy them for a friend's birthday even!
Dried out.,1.0,"Received these as a gift. Looked beautiful. Could'nt even pick one up, it fell apart. They were totally dried out and inedibly stale. Not sure when these cookies were packaged but my guess is sometime in 2018."
Great gift,5.0,"I have this as a gift to my 80 something aunt and she just loved it. I thought they they may be too hard for her but she told me that it made her day with a cup of coffee and she dunked!
She also loved the variety in the box. She shared on with her daughter but I don’t know if she was going to share past that!"
Stale,1.0,I sent these as a condolences gift to a relative. She called me after the funeral to tell me that they were stale. I don't know if thus was a one time event but it was very embarrassing.
Would not purchase again,1.0,"I sent these to my mother for mother's day, she let me know that they were not good, not something she could eat. They were pretty, but that was it. She had 2 friends over who thought the same. She said they were way too sweet and did not like the taste of them at all. She wanted to make sure I did not send them again. I'm very bummed by her response."
Disappointed!!,1.0,"I had ordered this as a birthday surprise for my cousin and was distributed to friends and family. I would have expected this to be really crunchy however this was a total disappointment as these were completely soggy, probably an older batch was shipped ! Also there is no way to contact the vendor (as I shipped it from overseas)"
STALE CHRISTMAS BISCOTTI WITH TASTE AND TEXTURE OF SAWDUST!,1.0,"TASTE AND TEXTURE IS JUST LIKE EATING SAWDUST. Was hoping these would be delicious. A real let-down! When were these made,...at Holloween? These are honestly the worst BISCOTTI and worst item I have ever ordered on Amazon. I wish the CEO of Amazon would taste the BISCOTTI I received. I wouldn't feed these to my dog. They're that awful. I'm a gourmet chef and being totally fare and honest in this review. Don't waste your money or time on this product."
Don’t Buy - Arrived in CRUMBS,1.0,"It arrived with the seal broken, damaged, and in crumbs. It’s inedible."
Horrible taste,1.0,"I had purchased these as a gift and it was very embarrassing when the recipient of the gift told me that
they tasted awful. Just a heads up for anyone wanting to send a food gift. Don't send these."
Completely yummy,5.0,"A family friend was kind enough to send us this product as a Christmas gift. All of us enjoyed these biscotti very much and I decided I would send the same to a friend to celebrate a special event. It was received happily and excitedly, I am happy to report, and I have plans to add this item to my Christmas giving gift list. It's a sure bet to please and to be a lovely presentation."
Don’t buy,1.0,"I am so unhappy with this product. Was a Mother’s Day gift said it would be there may 10 arrived today may 13 and all broken.
Did not present nicely as a gift and as food it should have been time sensitive for freshness. Totally dissatisfied
Update :
So they emailed me thank you for the review?! I guess they really don’t read them or care??
#badbusiness"
This product is awesome!!!,5.0,"I initially had a problem with the product but the owner insured me that she would take care of the problem and she did. Ashley, not only gave me a refund, but also sent me a box of the most delicious and fresh biscotti I have ever tasted. I plan to give the biscotti as holiday gifts this year.

I would send a picture of the beautiful packaging and display, but we ate all the biscotti. I would recommend Barnetts Biscotti Cookies Gift Basket for gifting and for one's self just to enjoy a delicious teat.

Thank you Asley, I appreciate your great customer service! You have made me a customer."
JUNK,1.0,MY BROTHER AND SISTER THEY COULD NOT EAT THEM I SEND ONE TO EACH FOR THERE BIRTHDAY THEY FELT BAD TO TELL ME THEY WERE VERY BAD TILL A WEEK LATER WHEN I WAS GOING ORDER ONE FOR ME..... I TOLD I WAS SORRY.. YOU LIVE AND LEARN TMOE.
Soapy Taste,1.0,This order was bought as an appreciation gift from our company to one of our employees. This was quite embarrassing for the company. He stated that the biscotti tasted very strange. He even tried a couple different flavors and they tasted like someone put dish soap in the recipe.
HORRBILE TASTE AND STALE,1.0,"TODAY, I GOT THIS FOR A GIFT.
VERY STALE AND ALL BROKEN UP INTO PCS.
JUST HORRIBLE.
BOX IN GARBAGE!
I CALLED PERSON WHO SENT IT AS GIFT.
SAID THANK YOU. BUT TOLD HIM TO GET REFUND OF THIS ITEM"
The worst,1.0,"I must’ve gotten an old box or bad batch because these were inedible, tasteless, horrible and went in the garbage. I’m an avid baker for many years and these were unacceptable."
False advertising!!,1.0,"False advertising!! The product is NOT vegetarian, nor does it contain “traces of egg” it contains actual eggs in the ingredients. Cannot claim the product to be vegetarian or kosher."
was a welcome gift,5.0,"gave to my mother for mothers day, arrived fresh and all cookies whole. she loved the different toppings. will order again for myself when she comes to visit."
You won't be disappointed. Worth every penny.,5.0,"I have purchased Barnett's Sweet Creations numerous times but this is my first review. First of all, the packaging is beautiful. I couldn't wait to open it. When I first opened the box, the aroma delightfully took over the room. Then was revealed the artistically prepared assortment of chocolate treats. It seems to me as though great care was taken to make each one. Then it became like binge watching a TV series you been waiting for. You want to have them all but then they will be gone. So I was patient, and took my time. I can say from the start of the order to the last crumb, it was a delightful experience. I highly recommend Barnett's Sweet Creations and will definitely be purchasing them again."
Arrived broken and melted,1.0,This was a birthday gift and they arrived broken and melted what a waste of money!
Sweet tooth this will be perfect,4.0,Delicious gift perfect amount for someone with a sweet tooth
Disappointed,1.0,I searched gluten free and this is what came up only one person out of 5 can eat as they are gluten free I was not happy
Product issues,1.0,"The Biscotti box was gifted to us. When we opened the box, biscotti looked very attractive and tempting. but when we tried one, it had a terrible smell of petroleum. Then we noticed, all of them had the same awful chemical smell. The manufacturer needs to do some serious quality control on the equipment, material and the ingredients going into this product. In its current state, the product is not usable."
Don’t purchase! Tasteless STALE,1.0,"Biscottis ARE tasteless&stale!! Boxing was pretty& such a shame,Zero flavor!! Very expensive$$ & please forward to mfg as they Need to know now,Amazon does not want sooo many awful reviews!"
Note missing...,1.0,Note missing...Note was not included in the package. This was a gift and the most important part was the note... and there wasn't any!
Wouldn’t buy again; many broken,2.0,"The product was very disappointing. The packaging was attractive but many of the biscotti were broken. As a result, the crumbs from each covered others and looked unappealing.

The taste was very average to below average."
"Soap Biscottis? Stale? Dunno....but buyer beware, these are NASTY",1.0,"Ok, this was a gift for someone in the family and holy moley, these are awful! Left the funkiest ‘film’ in our mouths and chemically aftertaste that is very persistent. Three of us tried them, and nope...all had the same experience. One reviewer said “soap”....that’s pretty accurate. SOO nasty.... Maybe we got a bad batch, or maybe this is how they taste, but I would never order these myself to find out."
Empty box delivered,1.0,Sent an extra large box of biscotti cookies to my niece and her husband as an anniversary gift. She opened the box and it was EMPTY.
stale biscotti. tasteless mostly air covered with thin layer of chocolate.,1.0,"stale and messy. ""chocolate"" was wet and runny. Not gourmet, not good. would not buy again. wish I could return these for a refund."
beautiful and delicious,5.0,"I received this beautiful and delicious box of biscotti as a gift, which made my day. unfortunately Amazon did not include a gift card so I had no idea who sent them. I reached out to Barnetts Sweet Creations and they quickly responded. I will definitely keep these in mind as a gift I would send. The variety are all appealing, hard to decide which to eat since they are all appealing."
"They are only 4"" long and have no flavor compared to Nonni's.and way overpriced.",1.0,"Smaller than Nonni's by an inch, not very tasteful, just decorated nice, will not buy again from here, way overpriced"
Perfection,5.0,"We received this as a Christmas gift from a very dear friend. We have always been coffee drinkers and enjoy a delicious cup. We had not had biscotti with our coffee for some time, so many are dry, stale or without flavor. It is unbelievable the freshness, flavor and quality of this product, we are sold and Barnett's will be our new obsession. We will be sending this product for gifts and treats to friends, family and ourselves from now on."
"Horrible, stale, low quality",1.0,"So embarrassed that I gave these as a gift.
Threw out the ones I purchased for myself too.
Don't understand the reviews???"
Disappointed stale and soapy taste,1.0,"I received as a gift and love biscottis. However, these were stale and had a very soapy taste. So disappointed."
Empty box...,1.0,The beautiful box arrived on time. My grandmother proceeded to open an empty box for her 98th birthday. See picture.
Stale!,1.0,"Product was a Mother’s Day gift purchase. My Mom loves coffee, especially with biscotti. She tried 1 of each flavor and said that the product was very stale. Across the board, the gift was not enjoyable."
Not a bakery quality,1.0,Damaged not great
Too expensive !,5.0,Too sweet!
Arrived open and broken,1.0,Arrived open and broken. Nasty. And NONREFUNDABLE!!
Disappointed and embarrassed by your stale cookies,1.0,The cookies were stale. It was a gift . Very disappointed. A fresh assortment should be sent by your company to Ed Riccib
Looks are deceiving...,1.0,These arrived and look beautiful but taste like sawdust with a sweet top. Would not give as a gift.
Valentine’s?,2.0,"Why is a Valentine’s Day package recommended for mother’s day? I should have read more closely I suppose, but I just assumed they would know what occasion by proximity on the calendar. Not the best time for a warm weather delivery either."
"Sugar Cookies, Not Biscotti",1.0,This is not biscotti. It’s more like sugar cookies. Very disappointing. And the price is absolutely outrageous. Borderline consumer fraud.
Four Stars,4.0,They were a gift for my mother she loved them
horrible gift,1.0,This was absolutely horrible. received as a gift. tasted stale among other things
Biscottis,5.0,Arrived at scheduled date and was in perfect condition and tadtevgreat
Over Priced,2.0,Not impressed for the price point.
Old - no good!,1.0,Product was no good! Couldn’t dip in coffee - fell apart- tastes old!
Wonderful,5.0,Great quality
Tasted and smelled like Puke!,1.0,My brother sent these to my parents. I have NEVER in my life tasted anything so bad. Tasted like Puke! Smell was really bad. I am trying to tell my parents to tell my brother they have to go back. I only took a bite of 2 of them. After the first one I spit out I figured let me try another. Just as bad. I tried to cut one and it was like dust after. Really bad.
Inedible stale cookies,1.0,Bought them as a gift but they arrived spoiled. It sucks to get a call from the person you bought it for as a gift hearing they couldn’t even alert them... do not buy
Redemption,5.0,Was just informed that the recipient of the order received another package with some very tasty and fresh biscotti. Thank you for being customer focused and addressing the issue.
Disappointed,1.0,"This is not biscotti, it tasted like shortbread and was completely melted when it arrived. Very disappointed since it was a gift"
Do not buy. Do not send.,1.0,"I meant to send this item as a gift, but I accidentally sent it to myself. I'm glad I did. I found out the biscotti are very dry, very brittle, and nearly tasteless. As others have said, some of them were also broken upon arrival. Perhaps a function of their being so dry and brittle upon shipping. Therefore, do not buy these cookies for yourself, and certainly do not buy them as a gift for others. My strong recommendation to you."
Delicious!,5.0,This was a gift to my long time friend! He couldn't wait to eat these! Even his dad who avoids sweet treats tried a few and loved them!
Lindo,5.0,Le agradó a la persona que lo recibió
Great gift,5.0,These were a gift for my mom. They arrived beautifully packaged and she raves about the taste.
Sadly this was a Mother Day Gift that fell short of edible.,2.0,Sadly this was a Mother Day Gift that fell short of edible. The baked goods were hard as nails. The packaging was beautifully done in contrast. So it is with a degree of sympathy for the seller and bakery that these were recycled after several attempts at consuming the product. This may be an isolated occurrence.
You can get sick tastes like soap,1.0,"There is a serious problem, 3 people tasted them and wo asking each other all said they tasted like soap and had a long aftertaste. Called company because scary and there is a problem, all they want to do is send a new package. Seriously wasn’t the point, someone will get sick"
Absolutely Delicious,5.0,"I got this as a valentine day gift for my daughter & granddaughters and they said it was absolutely delicious. It was fresh, the flavors were excellent. Would highly recommend this product."
Makes a lovely gift,5.0,"I sent a couple of these as Christmas gifts. The recipients were totally delighted. Delievery was prompt, and this site is on my list for next years' gifts."
Not very good,1.0,They were broken and very dry
A tasty hit,5.0,"From child to adult, the biscotti were a big hit for a birthday celebration."
Surprise,5.0,"Next morning delivery system is wonderful. I used this service for my grand son birthday. It's a surprise for him. Of course, the cookies were very good. He said they were very delicious, and very good for birthday party with his friends. I like this service and the cookies."
GREAT FLAVORS AND FRESH,5.0,"I sent these to a friend after her hand surgery. She called me immediately when they were received (after she and her husband ate one each). She said they were delicious and she’s promised to save me one. She talked about the great variety; I plan to order a box for our family. I made a good choice in my gift selection, you will also."
Like biting into a bar of soap,1.0,"White chocolate biscotti tasted like soap and left a weird film in my mouth. The soapy flavor lingered. So half the biscotti were inedible, and had to go straight to the trash."
AWFUL!,1.0,Sent this as a gift only to be embarrassed by being told it was old and stale. The biscotti was within the expiration date. This item doesn't even deserve 1 star.
Beautiful & Delicious Gift,5.0,"Parents loved it. Very fresh, nicely decorated and flavorful. Sent as Valentine's Day gift. Would send again as a gift to someone."
Bad,1.0,This product seemed old. The cookies were dry and crumbled. Not satisfied at all. Would return but can’t. Will not buy again
Rave reviews,5.0,"I bought this as a gift for 3 different people and they all loved it. I got rave reviews from everyone.
I will definitely be gifting this again."
Delicious!,5.0,"Sent this to my Sisyer and her husband for their Valentine Anniversary, they said it was delicious!"
Received as a gift. Have since gifted to 3 others,5.0,"Lovely gift. Delicious biscotti cookies. Was happy to receive from a friend, and proud to send out as gifts. Quick service too."
Tasty,5.0,Giftable
Great birthday gift! Who doesn't like delicious biscotti?,5.0,I ordered biscotti as a birthday gift so it has taken some time to review this product as the she went on vacation (me not knowing). When she arrived home it was a nice surprise. I think other family members enjoyed it too! They loved the biscotti! I am a happy customer. Thank you for being so prompt in getting the order out so quickly. It did arrive on her birthday.💕
Great taste,5.0,Bought this for my sister's birthday. She loves biscotti. She said they are wonderful
Dont order when its warm,1.0,It was sent as a birthday gift and the chocolate was melted. They said they would enjoy them but not the surprise birthday gift I wanted to send. Maybe I missed it but it should be put in the description not to order during the warmer months. Probably no chance of getting any refund at this point.
Fresh and Delicious!,5.0,"Great Gift! Was looking for An Easter surprise out of the norm, sent to 3 different family members All said cookies had a nice presentation, fresh and delicious!!!"
Tastes Even Better than they looks!,5.0,"They looked spectacular, nicely arranged in the box, but I wasn't sure if they would taste as good as they looked. I took a chance and sent this as a gift to my sister-in-law for her birthday. Well she loved them. We Italians love our Biscotti and these definitely did not disappoint. I'm always looking for something different to give and I would recommend them highly, and intend to buy them again."
The Freshness,5.0,"I purchased this item as a birthday gift to my uncle. He loved them and was so impressed by the freshness and flavors he asked where can he buy them, he wants more. Little does he know, I will be ordering two more to add to his Christmas gift. Thank you!"
