title,rating,review
Excellent gift idea,5.0,"Very nice gift idea, clean bc they are individually wrapped"
Quality.,5.0,"Item Was a Gift for a Friend, They Enjoyed it very much, was a favorite for a long time."
So good,5.0,So good make you want to slap your mama
Way to overpriced for what u getting,1.0,"Overpriced for sure, I ordered as last minute Gift and I also wanted to be delivered same day, that is the only reason I ordered these biscottis, I read previous reviews about looking cheap and too expensive and I have to confirm all similar reviews. I would not purchase this item again."
Broken cookies,1.0,Received broken cookies and not returnable item
Biscotti delicious,5.0,These are so fresh and delicious. Can’t stop with only one.
Great gift,5.0,"Great presentation good quality
Gift for 2 different family members
Both loved them"
Not worth the price,1.0,"The biscottis were small, not uniform in size, covered in crumbs and just okay taste-wise. Definitely overpriced and underwhelming."
Every piece was broken into,1.0,Was not what I thought the product should be. Every one was broken and they all tasted the same No variety in flavor Sorry I brought this
Great treats,5.0,These were the perfect thing to send to a grieving friend across the country.
Five Stars,5.0,I bought these as a birthday gift for my husband and they were a big hit! Thank you!
Perfect gesture,5.0,So DELICIOUS and great variety
Really good!!,5.0,Box is nicely done - cookiew were delicious.
biscotti,5.0,it was one of the best assortments of biscotti's I have ever had.
Tastes great and presents great,5.0,Bought for a present and they loved it!!!!!
way over priced for poor quality,2.0,taste
Delicious,5.0,These are Amazingly Indulgent Biscotti!! We have been very happy with them!
Make a lady happy - get her these cookies.,5.0,Got these for my SO for Valentines Day. She loved them.
Great product,5.0,Great taste and pricing
Not what I expected,1.0,"Bought for residents at a nursing home.
Was expecting Italian briscotti, for a coffee social with residents.
Will not buy again
Very disappointed"
Horrible,1.0,These are terrible. Save your money. Not like traditional biscotti at all more like layers of pie crust
Not fresh,1.0,"These arrived not fresh, each cookie was terrible (I only tried two) I wasn't satisfied at all.... they went straight to the garbage."""
very good. Eat in 3-4 days,4.0,very good. Eat in 3-4 days. Will get stale.
Great Buy!,5.0,They were absolutely delicious!! I bought them for my family as a treat and they loved them! The presentation is beautiful and would be perfect to give as a gift too! A great buy!
Look far better than they are!!!,1.0,"The sell-by date was 05/2020 but these seemed very stale, crumbly & tasteless (all one flavor as well), despite the snazzy-looking toppings. We were very unimpressed & disappointed, particularly as these end up being about $1.66 per cookie, & a pretty small cookie at that (each cookie is about 3-1/2” long)"
When dunking them in coffee the flavors explodes in your mouth!,5.0,Amazing!! Can’t get enough of these delicious biscotti we fight for them! Thank you for selling them!!!
Beautifully packaged,5.0,Beautifully packaged! Great for gift-giving.
Stale product,1.0,"Purchased this as a B/D gift for my mother-in-law she passed away without using the box. My wife went down for the funeral and said that the nuts were stale and the bread was not up to the 2 previous packages, however returns NOT allowed! Buyer beware!"
Excellent variety of flavors,5.0,Very fresh and extremely tasty...deliver time could have been a little better but I must admit well worth the wait!!!
Gift,5.0,Bought as a gift for my parents. They really enjoyed them.
They said they enjoyed them very,5.0,I gave them as a gift to a company I work for. They said they enjoyed them very much
Not worth it,2.0,I got them for my girlfriend as a extra gift for her Birthday they were alright but not fresh and definitely not worth the price
Delicious! Try these or send as a gift!,5.0,Received these damaged but customer service replied quickly to my concern. Barnetts definitely cares about their customers. I would definitely reorder. The few we could taste were very good.
Five Stars,5.0,"These were the perfect gift for my husband’s office staff for Valentine’s Day , they loved them ."
"Nice box, etc",2.0,"I sent them to my sister for her birthday in June 2018 and she said that they were a little bit stale. Nice box, etc. But they were stale."
Perfect for lots of occasions,5.0,These were a great hit at our event! Thank you!
Amazing,5.0,"Absolutely amazing product!!! Highly recommend it, you will not be disappointed."
He LOVED them!,5.0,Bought this for my 84 year old Step Dad for Father's Day. He LOVED them!
Christmas disappointment,1.0,We send these as a Christmas gift and they arrived stale and broken. Would not recommend to anyone.
overrated cookie,1.0,Arrived and chocolate was melted. It was not hard as normal biscotti. Flavors were not all that. Over all it more like a dry flavorless cookie
Not what I call Biscotti.,2.0,These are really just vanilla cookies with something on top with a weird after-taste. I really don't care for them and will likely throw them out.
"Barnett Biscotti 'a old, stale",1.0,All the biscutti cookies were very old and stale. The toppings of nuts and pumpkin seeds were rancid. Other toppings were tasteless. I could not eat them.
Barnetts Biscotti Cookies Gift Basket,5.0,Great product. Purchased as a gift. Would definitely purchase again
They looked better than they tasted I throw the box out,1.0,No flavor just not like the cookie should be for the price they should have been way better
Fantastic present!,5.0,I gave these biscotti's as a gift and I was told they were very very good. Looking forward to ordering them again.
Sent a box to several families and all raved about ...,5.0,Sent a box to several families and all raved about the quality and delicious taste of each and every piece.
Loved it so much.,5.0,"Loved it so much, ordered for 85+ Customers this thanks giving."
Yummmy,5.0,Soooo delicious! Perfect with my coffee in the morning!
Ehhh,3.0,"The taste is very average, but it makes an attractive display. All the cookies are the same flavor, with different icing and toppings. I wouldn't buy it again."
A unique and delicious treat,5.0,Your product is visually most appealing and delicious. Thanks very much.
Best cookies Ever....,5.0,These cookies are the best....Nothing else needs to be said... Perfection.... Gift of the Times...
Five Stars,5.0,"Nice gift although I was able to indulge myself, I heard it was good."
They look wonderful. They are a present for someone else,5.0,"They look wonderful. They are a present for someone else, so I can't say how they taste."
Very Disappointed .,1.0,Very disappointing. Bland flavor and the texture was was not desirable. They tasted stale. Several were broken in box
I send this as a gift for my family they loved it.,5.0,Thank you so very much! I send this as a gift for my family they loved it.
Come on no more ??,5.0,Nice
The worst biscotti I ever tried,1.0,"They were tasteless, bland, and soft. Nothing like a biscotti cookies should be."
It was very tasty,5.0,Very nice display.
Great!,5.0,Bought this as a gift for my boss and she loved it! Very delicious.
Very good and fresh!,5.0,Very good cookie! My husband isn’t a biscotti fan and even he liked them!
Five Stars,5.0,WAs so good make you want to slap your grammma! No joke so yummy
Great gift choice,5.0,"Awesome choice for a gift, very pleased, fresh and nice variety"
Five Stars,5.0,"LOVED the presentation, and the biscotti was probably the best I’ve ever had. 👍👍👍"
Absolutely delicious!,5.0,"Absolutely delicious Biscotti's! Very light, great flavor and variety!"
Bet you can't eat just one...,5.0,Incredible selection of delicious treats.
Recipients gave thumbs up,5.0,Recipients gave thumbs up
Very good cookies,5.0,This was a gift and it was fine in every respect.
Fantastic treats,5.0,It was very tasty.
Five Stars,5.0,"Nicely packaged, tasted delicious. Gave it as a gift and the recipient was very happy."
This product have to many chemicals,1.0,I was disappointed look good but to many chemicalas I order from my granddaughter I will newer order agien it is very unhealthy....
Gift,4.0,It was a gift sent out of state
Nice treat,5.0,Wonderful buttery flavor. Nice assortment in decorated box. Dad loves his gift.
... his family for Christmas and they said they were amazing.,5.0,I sent them to my son and his family for Christmas and they said they were amazing.
Tastes great!,5.0,Great gift!
Broken! What a mess!,1.0,These came totally broken! I don't know if it's the Packaging or the delivery either way this was awful I sent this to my sister as a gift but I will never do it again!
Five Stars,5.0,That tastes really good! Bought it as the valentine’s gift and my boyfriend loves it!
Four Stars,4.0,Nice gift for those who enjoy Biscotti.
Stale and bland,1.0,"They look very nice in the box, but they were stale and had no taste."
Shipped perfectly no broken pieces tastes wonderful,5.0,great product would buy again
Bought as Gift,5.0,Bought these as a gift...Recipient told me they were great. Nice box- classy presentation
Great gift,5.0,These were a fabulous gift and were very well received. Arrived quickly.
Misleading.,1.0,This item is not a biscotti. It’s a cookie. Very disappointed.
Very disappointed,1.0,Arrived melted and raste nothingike biscotti. Very dissappointed as did my guests I served them to.
Nice product and packaging,5.0,Biscotti was good quality. Ordered it as a gift and it was packaged nicely.
Wafer,5.0,"Light, very tasty"
Perfect gift!,5.0,Excellent quality chocolate covered biscottis.
Sattisfied in PA,5.0,"Arrived quickly, I sent theses to my favorite Ital. aunt. She loved them; her an my uncle said they hadn't tasted anything that good in years. She said they were fresh and tasted as good as they looked!"
"Nos encantó con mi esposo , rico con cafecito 😋",5.0,Es lo mejor
They came stale tasting and aren’t eligible for return.,1.0,"The biscotti cookies were in sealed packaging, but were stale. I am very disappointed in this purchase and would not recommend."
Never Buy!! Waste of money!,1.0,bought for a gift. came melted and a mess….unable to give for gift. UNABLE to RETURN for REFUND!! wasted $$$
Delicious!,5.0,"Perfect for gifting, beautifully decorated, tasty biscotti!"
Needs better packaging,1.0,One whole row was broken. They were too expensive to not have a better packaging
Scrumptious and beautiful - inside and out!,5.0,"Just wanted to compliment this company on their great, prompt service and the freshness of the cookies.. Bought them to give as a gift, and when i brought them home my kids ate them lol. I would recommend these cookies to anyone and everyone.."
Warm Up The Coffee,5.0,Very satisfied with purchase...great for dunking in the coffee.
Arrived Stale,1.0,"No flavor, dry, and stale upon arrival. I would not recommend this product."
Very good!,5.0,Liked the assortment had a little of everything.
Great variety and taste!,5.0,"Lots of types, all unique. Will purchase again."
I was given rave reviews by my good friends.,5.0,These were for a gift. I was given rave reviews by my good friends.
Fresh and flavorful,5.0,A tasty indulgence
Happy,5.0,These cookies were a gift. Recipient seemed happy
Not fresh,1.0,Items were stalled. Horrible.
Five Stars,5.0,Perfect gift for someone who has everything. My Mom really enjoyed the fancy biscotti.
Biscottis are great,5.0,my Wife loved this present and happily devoured them.
Inedible,1.0,"These cookies tasted stale, terrible!!! Since they are not returnable I had to just throw them out and money wasted 😡😡😡😡"
Delicious,5.0,The biscotti was great didn't last very long delicious
As expected,5.0,Very good
This is ok for biscotti but not fabulous.,2.0,"I wasn't crazy about these. They taste ok, but were not what I hoped for."
Home Run!,5.0,Everyone loved these biscotti. Tasty and attractive presentation.
Five Stars,5.0,Bought two as gifts and got to try them. They ar very tasty.
Disappointed,5.0,Awfully expensive cookies not Biscottis
No complaints,5.0,No complaints
No worth any amount,1.0,First I could not send any info to the seller. This what I would say. Your Biscottis are stale.
Good quality,5.0,loved the freshness and variety great product
Very Expensive,1.0,I bought it for gifting but I think it's a little bit overpriced
Disappointing non-biscotti,1.0,"These are low quality in a fancy package. They are not really biscotti, but had a crumbly texture that was unpleasant. Chocolate was low quality and flavor was unappealing. Very disappointed."
Never buy again.,1.0,Worse biscotti I have ever bought.
It was a gift,5.0,"Was purchased for a gift, and was enjoyed!"
Very Stale and could not return or replace.,1.0,Very stale..would not ever gift to someone or buy for ourselves.
Great to dip,5.0,Wonderful taste
Not very good at all,1.0,These do not taste like biscotti’s what so ever. I’m very disappointed.
Very good quality,5.0,Great selection
good for a gift,5.0,"tasty, but is too expensive, good for a gift however"
Five Stars,5.0,This was a Mothers Day gift. My mother-in-law said it was attractively packaged and the biscotti were delicious.
Not a true biscotti...half of the product arrived broken.,1.0,"Not true biscotti...not twice-baked, as is a true biscotti. It’s more like a standard shortbread cookie with frosting, shaped like a biscotti. Half of the biscotti arrived broken, which wasn’t discovered until my gift recipient opened the package. I would not purchase again..definitely not for the price."
Very disappointed!,1.0,Over priced. Very small plain cookies that are shaped to resemble an Italian biscotti. Not crunchy. All the cookies are the same except for the frosting which is also very plain.
I have no idea if they liked it or not,3.0,I sent it as a gift. I have no idea if they liked it or not.
Great,5.0,Loved them ..so delicious will buy again
Most of them came broken and flaky,1.0,"I would not order them again.

We ate some at our office. Was not impressed."
Great gift,5.0,Great gift
Delicious!,5.0,"We sent these biscotti to a friend who had just returned from the hospital. He (& his wife!) lived them. They were fresh, delicious, & delivered on time. These are my go to cookie gifts."
Terrible!! Will definitely NOT by again!,1.0,Didn’t look like photo at all. They came broken.
The best!,5.0,Best biscotti I’ve ever had!!
Tired of giving chocolates? Try this.,5.0,"Great variety, we'll packaged, ontime, tastes great."
Absolutely delicious!!!!!,5.0,Not just for Holidays...... Can't eat just one!
Doesn’t taste like it looks,1.0,This box of biscotti looks very inviting. However the taste doesn’t live up to its looks. I have to say this is some of the worst biscotti I have ever tasted.
Order it,5.0,The best I ever had
Very expensive for this quality,2.0,You can do better in your kitchen.
not a good value,1.0,too expensive and good but not great. disappointing
Stall Inedible,1.0,This product was sent as gift and thankfully recipient said how awful it was
Great gift,5.0,Great
Nasty,1.0,I wouldn't eat this if it was free. I can't believe the cost for this lame cookies.
Great product!,5.0,These were packaged well and tasted great!
Our Go-To Gift idea,5.0,"We have sent this out countless times to friends for a thank you, birthday, or anything and they always rave about it. Yesterday we actually saw what it looked like for the first time as we sent to a doctor's office and we just happened to be there. The staff loved it. The biscotti are small - not like the huge ones at Starbucks. They each are embellished with different goodies and the taste was fantastic. So glad we got to see the presentation box and the products. We will continue to send this out for all occasions!"
not again,2.0,"cookie was flavorless,toppings were actually dried out"
Cookies,5.0,Cookies
Chalk,1.0,Tastes like chalk. Super dry and brittle.
Excellent Choice!,5.0,"Sent them as gifts, everyone loved them!!"
"Very poor quality, taste and messy presentation.",1.0,Did not like at all. Wasted a high price on bad product. Do not recommend
"Will not purchase again, very soft.",2.0,"The pkg. and decorating was very nice however,the texture was not firm like one would expect in a biscotti. Very disappointed in this produce"
Rancid biscotti,1.0,The almonds were rancid...i took these to an office party...it was embarrassing. ..there was one with chocolate crumbs on top that people complained their lips felt like they were going numb....i threw them out...i would not sell them to anyone else
Most were old in taste,1.0,Gift. They were not fresh at all. Not worth the money. Sorry i bought these.
Perfect,5.0,Perfect
She loved,5.0,Sent these to my aunt for Valentine's day. She loved them
Fresh.,5.0,Taste great.
Quality is not good,2.0,Not fresh at all.
Don’t waste your money,1.0,"These are the worst, stale Biscotti that I have ever tasted. Thankfully I didn’t end up giving it as a gift. So expensive and not at all edible."
Good,5.0,Good biscottis
I don't think I'd order again,2.0,They were a little dry.
Excellent....great services,5.0,Excellent!
"Kosher, Delicious, and Beautiful",5.0,Our guests LOVED these.
Cheap cracker,1.0,No flavor especially for the price. Very disappointed.
Very expensive for what you get. Never order again!,1.0,Too expensive for what you get!
Dry tasted old would not but again,1.0,Dry tasted old. Would but but again or gift
Five Stars,5.0,"If you're on diet, don't buy this. It's soooooo yummy, and I couldn't stop eating."
Delicious,5.0,The biscotti cookies are delicious. Nice presentation.
Product over priced,1.0,Taste was terrible
THE WORST BISCOTTI I HAVE EVER TASTED,1.0,"The biscotti were not even edible, I was extremely embarassed since I ordered one for myself and a gift to another...They are hard tasting, they taste like nothing I have ever eaten, no flavor. Complete waste of good money!"
Perfect gift,5.0,great with fine coffee and good friends
stale flavor,1.0,tasted old not much flavor
Yummy,5.0,They were a much appreciated gift.
Just like Italy,5.0,This was a gift to my sister and her family. They all loved it and commented how fresh and delicious it was.
Muy buenos,5.0,Muy buenos
Five Stars,5.0,Very pretty and tastes sooo good...The pkg. was also nice
Product crumbles and didn’t taste like Italian biscotti,1.0,Product crumbles and didn’t taste like Italian biscotti
Nice treat for family dealing with the flu,5.0,Pleasant treat when everyone was sick. Tasted wonderful and fresh
Not fresh and tasteless,1.0,I bought some for me and some friends of mine they said they had to spit them out .. they were not good .. they tasted nothing like a biscotti .. I think they were old
They were broken and tasted stale. Awful.,1.0,They tasted stale. All but 6 were broken. Would not purchase again.
Yuuummmy,5.0,Absolutely delicious. Everyone loved them! Quick shipping.
Very good,1.0,Very fresh
no taste just sweet,2.0,"no real flavor, just sweet disappointing"
they weren't what i expected at all.,1.0,They didn't have much taste.
I will never buy this again,1.0,Too much money and not good at all
Ordered as a gift and they said they really enjoyed them! Looked presentable and smelled delicious when I ...,5.0,Ordered as a gift and they said they really enjoyed them! Looked presentable and smelled delicious when I received them. Would order again
... biscotti was a present for wife who was very pleased.,5.0,The biscotti was a present for wife who was very pleased.
Product looked old and packages worn.,1.0,The product appeared to be old. The box was worn and did not have a ribbon around it. Just the glue where the ribbon was. The cookies were broken and pieces were throughout the wrapping. Looks presold or old. Would not buy again.
Five Stars,5.0,"My friend loved them, she said, they were delicious!"
No flavor and stale,1.0,They were tasteless and stale
great gift idea,5.0,beautiful presentation and amazing taste!
Do not recommend,1.0,Not what I expected. Not worth $39
cookies,5.0,"very delicious cookies, love it!"
"looked great, was very happy with",5.0,"Bought as a gift, looked great, was very happy with purchase"
Gorgeous and so flavorful Barnett’s Gourmet Biscotti!,5.0,They looked wonderful!! So flavorful and tasty!!
Don’t waste your money. Tasteless!,1.0,Tasteless biscotti cookie product. I should go in business. Truthfully any store bought cookie/biscotti would taste better. Sad they are in business. I rarely write reviews but this product was a terrible purchase.
Broken Biscottis,1.0,"Unfortunately the biscotti‘s were broken. Trying to find a place for somebody to contact me to replace this, but so far nothing. It is a shame!!"
Great!,5.0,Great gift for the holidays!
huge waste of money.,1.0,Soft flavourless Huge waste of money
Dry. Dry. Can not eat.,1.0,There is no saving this box of dry falling apart . Took a bit . Use. Now they are saying can not be sent back .
Stale Stuff,1.0,The biscotti and biscuits came as stale and my brother complained about how useless that gift was for him as they had to throw all the packets out. Why is that!
Biscotti usually tastes much better,1.0,Did not like the size. The texture was not appetizing.
Excellent Biscotti,5.0,Beautifully packaged and delicious Biscotti!
Tasty!,5.0,sent as a gift. Everyone seemed to love it!
Don’t buy,1.0,"MAJOR DISAPPOINTMENT!!!!!! Item was stale tried pieces of two biscotti and they turned to dust although they were advertised for Fathers Day, tasted like they were packed for Xmas. At $36 for less than pound and no returns policy I felt it was a serious ripoff DONT BUY!!!!"
This product wasn't worth the money,1.0,This product wasn't worth the money
excellent,5.0,Gift
great product,5.0,great product delicious very tasty
good product,5.0,good
STALE,1.0,This arrived and it was stale . There was no crunch .
Bland,1.0,"All the same white biscuit/cookie only the toppings are different
Disappointing"
The paper was stuck to the cookie and the chocolate,1.0,I was very disappointed. Went straight to the trash
Very Good,5.0,The biscottis were delicious!
Biscottis,5.0,The diversity of flavors was good
"no flavor, miniature size, and way overpriced. TOTAL RIP-OFF!",1.0,"Garbage product with miniature pieces and no flavor, shame on this company for ripping people off"
Nice,5.0,Bought it as a gift for my boss. The package came in and all the biscotti were intact. Looked beautiful and made me want to open and eat them myself!
biscotti,5.0,I bought this as a gift.
Melted Biscotti,1.0,Many of the biscotti were melted. The taste was disappointing. Would not recommend.
awesome,5.0,my mother loved them
Disappointing.,3.0,"We received as gift. We wanted to love, because they were nicely presented. But much too soft, crumbly and most were broken. Also too expensive for 24 small pieces.
Prefer Nonnies, large & individually wrapped, with some ""bite"" to their biscotti. Just can't recommend knowing they overpaid for a box of 24 crumbly ""cookies""."
Perfect gift!,5.0,Absolutely delicious . . . the perfect gift!
Nice gift,5.0,Tastes good
Give to ones you don’t like,1.0,Way overpriced. Very small. Buy locally and get a better deal
The biscotti was powdery and tasteless. It was throw them away. I’m very disappointed!!,1.0,This was a birthday gift for my sister.
Yuk!,1.0,"These are horrible. These left a really bad aftertaste. Tried a bite from 3 or 4 flavors, all were the same so it has to be the biscotti recipe. I think the cookie were stale."
Delicious!,5.0,My wife loved them!
Great gift,5.0,Made a great Thank-you gift!
Biscotti worth buying!!,5.0,"Great Product, Great Presentation!"
will order again,5.0,Excellent product and nicely packaged.
Pretty Biscottis,5.0,Good Biscotti and very pretty
Five Stars,5.0,The presentation is nice but they wont be opened until Christmas.
This product is very disappointing,1.0,"For the price this is a very bad product, the images look great but the product is much smaller and tastes bland to terrible. We threw out 50% of them after trying several flavors."
Stale-would not recommend,1.0,The product was very stale and the sunflower seeds actually tasted rancid which ruined the flavor of the biscotti. Through away the entire box. Would not recommend this product.
Ended up throwing away.,1.0,Cookie was so dry. Horrible. Threw away
Disappointed in this product.,1.0,Stale. Were dry any tasteless.
Sorry excuse for biscotti.,1.0,"Texture was too crumbly. Rather flavorless. I do not recommend this product at all. Nice presentation though, but that was it."
Good gift,5.0,happy with the purchase
It does not look like the picture.,1.0,"This product was a super disappointment. I ordered for a party and it came in looking like into was old , on a shelf for a while and not something I would ever use for a party or use as a gift."
They were dry and crumbly!! I would never order them again!!,1.0,They were very dry and crumbly!! I will never order them again!!
Old,1.0,Not as fresh as I would have like them to be
Tummies Cookies and Impressive Gift Box!!,5.0,Absolutely Delicious!!
Not crunchy and lacks flavor,1.0,Authentic biscotti is crunchy and flavorful. This product was anything but!
We're not enjoyable.,1.0,Items were stale
damaged crumbled cookies,1.0,Cookies were damaged
Excellent,5.0,Delicious fresh beautiful assortment.
What a great deal!,5.0,"These biscottiis were absolutely DELICIOUS!!!! The wrapping was sensational and came, thankfully, in perfect condition. I am going to order a bunch for my vendors this holiday season...."
