title,rating,review
great for a gift,4.0,"more like a cookie, so not good to dip in coffee"
yum,4.0,expensive but good
Not bad but.....,4.0,A nice box for presentation. The flavors were a little bland for our taste and seemed to be a little stale. It would be giftable but I would only recommend doing so during the winter months. It was shipped with no freezer packs so things were a little melted.
Perfect gift!,5.0,"This gift was perfect for my sister (who lives far away) in celebration of her being healed from cancer. She is very grateful and biscotti is her ""luxury indulgence""."
Even though it wasn’t that great - the seller made it right,4.0,It’s very taste dependent.
fresh,4.0,The main thing to understand is that these cookies are sweet. If you like sweet then these are for you.
Great gift,5.0,My friend who received this says it is delicious.
These are not as expected,3.0,"The cookie/biscuit is more like a shortbread than an actual biscotti. They are all the same flavored cookie/biscuit with a variety of toppings. I was hoping for a variety of cookie/biscuit flavors. Ultimately not great, and they do not work well with a hot beverage like tea/ coffee/ hot chocolate. I was disappointed."
My package was damaged and can't return or replace,5.0,"This was a gift besides, getting a cake, for my sisters Birthday tomorrow. I guess I will have to get a cake. The birds and squirrels will have a nice expensive treat. Not very happy......grrrr

UPDATE!!!!
My biscotti was replaced and Barnett was very easy to work with. My sister was able to enjoy them with her evening tea"
Delicious,5.0,I send these all the time! Everyone is so happy with them
Is this really biscott?,3.0,"It's delicious, but seems more like an English tea biscuit than Italian biscotti. Or maybe Danish cookies. But not the texture of biscotti like I am.accustomed to."
Wonderful,5.0,Purchased a a gift for my mom.She absolutely love it.
They were so wonderful.,5.0,They were so wonderful. Everyone loved them. Great gift
Great Gift for Holiday Dinner Hostess,5.0,"Fresh, delicious chocolate varieties, was a huge hit at dinner. Great alternative to all the pies!"
Very nice,5.0,Exactly what I was hoping for
Buen producto,5.0,Ecxelente sabor
Light and delicious,5.0,"First time buying these to see if they were actually giftable. They are. Very elegant presentation and they taste great. They are light and crumbly, not crunchy. I like them."
Well packed,5.0,Fresh dunking and well presented
delicios!,5.0,Delicious!
Best present ever,5.0,"My son and daughter-in-law gave this to me a couple of years ago and I loved it so much I've given it as a gift a number of times. Even gave it to my husband as a gift, and lucky me he shared!"
Their small. They look big in picture but their not,5.0,Gift for someone.
Only if you serve when you open,3.0,Not very fresh. Stale within 2 days. Small and all tasted alike.
Delicious!!!!,5.0,"Purchased this for a gift for one of those people who has pretty much all she needs.
She opened it and was so surprised at how beautiful everything looked. As she was tasting, I was nervous since I never tasted them, she loved them!!!!!
Highly recommend!!"
Cookies are delicious,5.0,This was for a gift that was well appreciated
so delish,5.0,these are great and a perfect gift!
Items damaged,4.0,Items damaged
"Not quite the consistency of true biscotti, but they taste good and my wife loved them.",4.0,"I ordered these as a Mother's Day gift for a wife who has EVERYTHING. She loves biscotti, especially chocolate covered. These came nicely packaged and the toppings looked great. My wife loved them. When we tasted them, they were not hard like true biscotti; they had the consistency of a shortbread cookie. Nevertheless, they tasted great and my wife was thrilled. They were unique and she appreciated that I put some thought into her gift; not the same old, same old chocolates."
Nice presentation..,5.0,"Great appearance and delicious product..given as a gift and well
received..yum!!"
Overpriced,3.0,"I felt the cookies were tasty, but overpriced. It made a nice gift to give someone but I didn’t think they were worth it."
Very Tasty!!,5.0,"Very tasty, Delivered with all Biscottis intact, But...must have been packed on a Monday, because one was missing...Oh well"
Birthday gift,5.0,It was a gift. The person getting it said it got there on time and the family liked it.
Broken & more cake/cookie vs crisp biscotti,3.0,"Almost 25% broken. Toppings not thick enough to have real flavor, which seems to be flavor for biscotti and the actual biscotti us bland. B No crispness to expectations of biscotti which were all one note the same. They were more cake/cookie like vs. having crisp snap of a biscotti."
It was nice to send someone,4.0,we gave it for a gift
Pretty s d sweet.,3.0,They look beautiful in the box. Taste seemed dry and without flavor on the cookie part. Not solid like most biscotti. Too crumbly for dipping. Topping has different flavors. Less topping would be better.
soft and amazing taste biscotti,5.0,"My wife and I used to enjoy biscotti with daily morning coffee but we stopped having them because the ones that we had were too hard. The cookie part was so hard that we had to dip it into our coffee to soften it up but this became more of hassle than enjoying our morning coffee so we stopping eating all together.

One of our friends recommended this Barnett's chocolate biscotti because they told us it's very soft.
We were both drooling when we opened the box and could not resist all the chocolates and nuts covered on the biscotti but what really impressed us was the softness of the biscotti cookie.

The biscotti was very soft and chewy. It literally melted in my mouth while having it with my morning coffee. My wife and I thoroughly enjoyed every one of them and we will be ordering some more for sure! Simply amazing."
Good gift as long as they get properly shipped,5.0,"This looked really cute to give as a gift to my dad that loves milk and cookies. Unfortunately, this was shipped in a thin plastic bag with no bubble wrap or anything extra so it offered zero protection against making the trip to my door. Delivered with a few of the cookies melted that later hardened again against the paper covering, two of the cookies are broken, the re-hardened chocolate is holding one of them back together. Awful way to present a gift, I expected more especially being considered as gourmet. Find gourmet cookies or candies to buy in a store instead so you can actually purchase them in great condition and also since this item is not returnable, wasted money.
---------------
Updated review: The company reached out to me, refunded and offered to replace the box with better shipping. Last year for Christmas I got their chocolate covered sandwich cookies as a gift which were great, ordering during the summer and biscotti being a bit more fragile you can see would need more prep to ship. Although I had already gifted the damaged box of cookies, the box itself that they were stored in was cute and the biscotti did smell great. I appreciate Barnett's for going above and beyond to fix the error, good customer service so you can order with confidence."
Biscotti,3.0,NOT WORTH THE MONEY
Really nice assortment and flavors,4.0,"We really liked these - it was a bit of an unusual gift. The assortment and the flavors were terrific, but they dry out very quickly, so you better plan to eat them quickly."
Looks Delicious....NOT!,2.0,"Definitely one of those purchases where I wish I had heeded to warning of previous buyers. This product showcases nicely, and that's where the enjoyment ends. Everything tasted bland, absolutely flavorless. Definitely not worth the price. I'm sure more people will buy these cookies, thinking they can't possibly be that bad, and like those of us before them, many will be disappointed."
Tiny,5.0,"Tiny cookies, 3 bites and gone but good."
Was a gift. They loved them,5.0,Was a gift they raved about how delicious they were
Wonderful gifts in past orders. But this one was in CRUMBLES.,4.0,"I reached out to get a ""replacement"". I'm in process of awaiting a reply.
UPDATE: We received a replacement box in tip-top condition. This company was very responsive and I would shop with them again and again. Great gifts."
Makes a nice gift.,5.0,"I have ordered it as a gift to a few friends and received much thanks. Honestly, I have never tried it myself. But... it seems to make a good gift"
Melted Chocolate,3.0,"I bought three of these Biscotti Gift Boxes, one box came with melted chocolate. Not good."
Cookies!,3.0,Good selection but wasn't as fresh as I'd hope for. The family ate them in one night
Tasty,4.0,These are super yummy. But the package was totally messed up. And some of the chocolates melted off while in shipping.
The best,5.0,An excellent gift!
Disappointing for the price,3.0,"While these treats tasted good, they arrived broken and with some of the toppings melted."
Bought As A Good Gift,5.0,"This box of biscotti was sent to a beloved friend. They said they loved it! It opened up in a good aroma of vanilla and chocolate. The only complaint was that it looked TOO gourmet, haha! Good gift for a good friend."
Excellent,5.0,Delicious
Great Gift Idea,5.0,"Here is something to get for a person you care about and yet you’re not sure what to get as a gift. It is sweet, and special enough to say you care!"
Dry.,3.0,"Each had the same flavor, bland vanilla."
They were all melted,3.0,They were all melted and out of place
A gift for my brother for his birthday I liked it very elegant,5.0,I was so happy ordered it got it the same day Amazon awesome it comes in a nice box with a black bow I knew my brother would love it and he called and really did.
Delicious but….,4.0,"Delicious, six different biscotti, beautiful box. Problem was five were broken, broke more trying to remove from box."
Beautiful presentation,5.0,"I got this box for my boss' birthday. Biscotti's are her favorite, so these were absolutely perfect. There are 12 in the box and you get 2 of each type. They're covered in either white, milk or dark chocolate. The 3 white chocolate ones have either cookie crumbs, dried cranberries or coconut on top and the 3 covered in milk or dark chocolate have either caramel chip, almond crunch or peppermint on top. They come in a super cute box. I love the teal letters and accent colors on the box and it's even better that the box has Happy Birthday already marked on it. I didn't even have to wrap it! If you want a birthday present that will wow the recipient, this will do the trick."
Quick delivery,4.0,They were delicious
Mother loved this,5.0,Got this as a Mother's Day gift. She loved it.
Mom's Day Gift!!,5.0,"My mom lives Biscotti, so when I came across this posting I knew it'd be perfect. It ships in a decent amount of time, it's super sealed, and they were really pretty!! The only issue is that the flavors and toppings aren't listed anywhere on the box or inside packaging. So I had to come back to this post to screenshot n send to her. So that was a damper. But all in all a good gift!!"
Awesome gift!,5.0,This was a gift for my mom. It was the perfect gift for her! She loves her biscotti and can be a little picky about the ones she gets so the variety was perfect for her. She said they were all delicious!
From frown to crown 🙂👑,5.0,"While the cookies look very nice and delicious, the carefully wrapped package was missing a cookie making it ungiftable.

UPDATE: Based on the above review, the company reached out to me about my dissatisfaction. To their credit, they were genuinely concerned about the product I received. They went way above and beyond to make sure I was happy. Since the first review, I can definitely upgrade my review to five stars, six if I could. Also, my family gathered and I served the biscottis to rave reviews on the taste and texture. I will be a return customer and suggest you do the same. You won’t be disappointed ⭐️⭐️⭐️⭐️⭐️⭐️"
Good,5.0,It was good for a gift
Delicious,5.0,"Dear Barnett's, I hope you get this message. I bought these biscotti for our family in Australia. Since you are Australian living in NJ ,I thought our cousins would appreciate it and think it was pretty funny. Well they were sent off in a package with some other gifts. Unfortunately the Australia Post took possession of our package and wouldn't let it go through customs because I had sent some tomato seeds. Even though they were completely sealed up,seeds are a no no. Why they didn't just take the seeds out and send the package on its way is a mystery to me. They sent the whole package back to NJ. So your biscotti went over 20,000 miles and not one of them broke. Anyway I just wanted you to know how good your packaging is and if you haven't been home for a visit lately at least some of your biscotti had a quick visit.
BTW they are delicious"
Only beautiful packaging.....inside is a mess!,4.0,"The biscotti came in beautiful packaging but when we opened them half of the biscotti were cracked, there were lots of crumbs everywhere. When we tasted them there was no flavor, and they did not taste fresh. I would not recommend this product as giftable. It's nothing like the picture shows.

UPDATE: 3-3-21
I had contacted the seller and Adley gave me a full refund and actually sent another package of the cookies and asked to let her know how these looked and tasted. These tasted a looked about the same as the first ones so I am not too happy about that. I am very impressed with their customer service though. Thanks Adley!"
Biscotti not great and too soft,3.0,Wasn’t crazy about any of the flavors and disappointed in the lack of crunchiness. Biscotti in my experience is supposed to be dunk-able in your coffee but there is no way you could dunk these; they were too soft. Didn’t care for the flavors. Recipient opened and shared immediately with me; I was embarrassed at quality for price.
Mmmm,4.0,"Well they are good, but as a mexican that eats alot of pan dulce i don't think I'll buy another box, not worth the price, i can easily go to my local panaderia and gen double the bread half the price and like x4 times the amount"
They were ok but stale,3.0,They were stale
received replacement thank you!,5.0,good and fresh biscotti
Biscotti,5.0,The biscotti were delicious!
The Biscotti Cookies are VERY SOFT and not the firm crisp ones like from Italy.,2.0,Half the box had broken cookies due to shipping and softness of the product.
I give these as a gift,4.0,My only negative is that the write does not tell you that they are minis only about 2.5 inches long. Need to eat 2 or three of them at once. to equal a full size one.
Really yummy!,5.0,"Have previously written a review for this item, however, this item was found to be extremely yummy from a person who is hard to please. Arrived quickly, tasted great, nice variety, and I was told definitely worth buying again!!"
A really great gift,5.0,This gift really cheered up my best friend so far awsy. She was delighted with texture and flavour.
Disappointed!,2.0,These were advertised as biscotti but they are not! They’re just crumbly cookies….they don’t even look as nice as picture. So disappointed! And they weren’t fresh…tasted old.
Very delicious,5.0,It was an excellent gift.
Good product - Good company,5.0,"After receiving the initial order, found crushed biscotti. I suspect it was via delivery but had no way of knowing. Previous orders had always arrived in tact.
The company immediately reached out (reading my review) and sent another order. Outstanding customer service. They sent several communications along the way and it is apparent that they truely value their customers. The biscotti is of excellent quality and I will continue to order from Barnett's."
Dry & Broken.,2.0,Dry and broken.. More like sugar cookies that biscotti.
Mom loved them,5.0,I sent them to my mom she said they were taste and she loved them she told me a great gift
"Stale, tasteless, crumbly - update 03/02/2021 - 4 stars for their outstanding customer support",4.0,"I don't know where those high reviews came from, but I will never by this product again. After the initial dive into the box no one would eat any more so they were thrown into the trash.

03/02/2021 - The company provided me with a full refund. Pretty unexpected and quite impressive. They also asked if that could replace the box we had received to see if there may have been a problem with the one we got. We sampled it today and found this box was much better than the previous one. They certainly stand by their product."
Not traditional hard biscotti,4.0,Not traditional biscotti was soft. Bland. All varieties tasted the same.
Check the expiration date!,3.0,"CHECK the expiration date sticker on the bottom of the box before eating! Amazon has apparently been sending out old stock from the back of the warehouse. I ordered a box in May 2021 and received one with an expiration date of 5/1/2019! Yuck!!!!

The company, when contacted directly, did send me a replacement item. And they were tasty. However, the gentleman in customer service said it had just been baked that day and the expiration date was 1/15/2022. What kinds of preservatives are in these that they last for 8 months? My box that was several years old looked exactly like my box that was fresh. Identical. I would absolutely have eaten them if I hadn't happened to see the date. And, by the way, that means that the first box I received would have been baked in 2018! Ick."
They look better than they taste,4.0,They are pretty sweet biscotti.
Package must have been old,3.0,"Sticky, melted, and stuck to package"
My daughter and son in law loved them.,5.0,Looked and tasted as shown.
Taste,5.0,Love them as a treat with coffee. Gift them to my sister-in-law as she has lots of allergies ta additives BUT she can eat and loves cookies!!
Mornings are so much sweeter,5.0,The cookies are the perfect size for dunking in tea or coffee. The chocolate ones are the best. The cookies are sweet enough that it's not necessary to use sugar in the beverage. It's hard stopping at just one!
Not worth price,3.0,Not that flaverful
Love the good taste and the portion.,5.0,"I'm not a real biscotti fan...Generally speaking...but these are absolutely great! I’ve tried it out and totally in love. Me and my family of 4 love these cookies very much and we will definitely buy them again. They are not the usual type of hard biscuit, they are more like biscuit, but not too sweet, icing and various toppings make them more perfect. Will definitely buy them again."
Not a favorite,3.0,A bit on the dry side. Hubby did not like and will not order again. I have had much better.
Mother's Day Ooooopppsss,5.0,"SO there was an Oooooppppssss made when we ordered this item for a Mother's Day Present. The Amazon box arrived in perfect condition and so did the Barnett's Box inside. The problem was the Barnett's Box was completely empty, not even a crumb, like the box got skipped when they were filling them. Adley at Barnett's Sweet Creations went way above and beyond to correct this mistake. She refunded us, sent a fresh box out to Mom and sent one to us. More than what I expected. The best part was the biscotti, the wife and kids loved them. Mom liked hers too. Thanks Again Adley. We would order these again, just based off of the customer service."
They arrived melted!,2.0,"Was a gift for my mother! She stayed home and waited for the delivery. She picked up the package within 2 minutes of arrival (off porch). Mom said they were all melted, but told me they were very good 'because i bought them for her!' Not to worry please, ""I will eat them anyway!"""
"Good ,but Overprice",4.0,"They looks better on the website , and I think it’s over price ,,,the flavors not bad at all ,,,, disappointment with the box ,"
Too sweet.,2.0,Too sweet.
They are fantastic!!!!!,5.0,Have ordered these in the past and there are fabulous!!!
Not worth the money…,2.0,"The biscottis were melted and messed up, which we thought, ‘okay, they will make up in flavor what they lack in presentation.’ Nope, wrong. They tasted stale and bland. I would pay maybe 10$ for this product, but definitely not 40$."
My sister loved them.,5.0,Gift. Sister loved it.
"Tiny little cookies, more like samples than full size cookies.",4.0,"The size of the cookies is a little deceiving. They are not full size cookies as you would see in a bakery or grocery store. the box is 12 in. wide and there 3 cookies across. With the gaps left between cookies the actual size of the cookies is about 3 inches, not the normal 5ish you would get at the store. For nearly $40 I was expecting full size cookies. They have a return policy and will likely send these back and just get some store bought ones. The quality appears to be top notch, they are all well made and look delicious, just can't get past the price/size ratio.
Update: Barnett's offered a full refund in light of my dissatisfaction of the cookie size. Due to their customer service i have changed my rating to 4 stars. My wife also confirmed that the quality of the cookies was good, everyone she shared them with enjoyed them and they weren't stale or broken as some other reviewers have experienced."
"Very good,great gift",4.0,"Great flavor, nice selection"
More shortbread than biscotti,2.0,These are small and more like shortbread than biscotti. You’d do best to just buy Nonni’s.
Easy to work with,4.0,"I had an issue with my order. However, they were very accommodating in taking care of it. Thank you!"
Tasty however more of a crisp cookie than a traditional biscotti,5.0,"I was gifted a box of these last Christmas and managed to stretch them into February. I decided to just purchase my own. I seldom find a treat that I can not live comfortably without.

Now to the review of the product. A three by one inch with a slight variation in size between the four types. Each covered frosting/icing with decorations, nuts chocolate chips etc. which is slightly sweeter than the cookie. The cookie is mildly sweet similar to most cakes. The one with the white topping with a chocolate drizzle and raisins is fragile and tends to break. The rest did not break apart when taking them out of the box. The cookie itself are all the same flavor except to the topping. I would like to see other flavors but enjoy them as they are."
Box came damaged. Product was dry.,3.0,"The box was damaged when it arrived, the biscotti’s were dry and the icing was melted."
Not a traditional biscotti.,4.0,"These are beautifully decorated and packaged. However, I would not reorder in the summer months. They arrived with the icing melted to the paper on top of them. They are good, fresh and soft. Too soft to dunk in coffee. They might make a good gift for someone who is not expecting biscotti but a soft cookie."
If you've had1 you've had them all,4.0,"Liked the flavor. Just too much of the same. Texture was more of a cookie than that of a biscotti
However they were were fresh and made a great presentation."
Great gift,5.0,Got these as a birthday gift for my sister. She loves biscotti with her coffee and she said these were excellent.
It was more of a very dry shortbread than biscotti and crumbled before you could dip in tea.,3.0,I like to dip in tea. It was a dry shortbread that crumbled when you took a bite and dissolved when dunking. Very pricey for the quality.
Great Product and good delivery system,5.0,"This is the second time that I ordered….product is fresh, well presented and the delivery was on time.
My daughter love them."
Stale and crumbly,2.0,Very disappointing product.
Freshness and flavorful,5.0,"I received this as a gift for Valentine’s Day and I have to say, it was a great gift. It was delicious and I was surprised how fresh it was. I just ordered my second box last week. I highly recommend anyone to buy this for a gift or for yourself"
Riquísimos,5.0,Su sabor y frescura muchas felicidades !!!
The Thrill Is Gone,3.0,"Beautifully and sturdily boxed. Nice to look at a a newly-opened box. But the cookies seem all the same and the frosting, while different in colors, does not have a lot of difference in taste."
Good gift,4.0,Nice box. Great gift presentation. Very dry biscotti.
Barnett’s Biscotti Cookies,4.0,"great gift, cookies are very dry, good for dipping"
Beautifully packaged,3.0,Purchased as a gift. Packing was beautiful. These are not your traditional biscotti. These are more of a cookie (soft). They were tasty and very pretty.
To Sweet,3.0,The cookie itself lacked flavor. The chocolate covering was a little sweet but the toppings were good.
Delicious Gift,5.0,I have sent these to my daughter in law twice. She says they are delicious and loved having a tea party with my grand daughter. Will certainly order again!
Broken,2.0,They arrived broken and messy
Good cookies!,4.0,The flavor was excellent but they arrived all broken up. If the biscotti were in one piece they would make a really good gift.
Delicious and fresh,5.0,These are delicious and fresh biscotti. I like that they are not hard and dry but softer and very flavorful.
Consistency Great!,5.0,Highly recommend
They taste ok,3.0,They taste ok. They are like crunchy shortbread but drier.
Really good,5.0,Got this for my dad for Father’s Day. Box was beautiful. Packaging was tight and nice. He loved them.
Not really biscotti.,3.0,Not bad cookies. Nice packaging. Not biscotti tho.
