title,rating,review
Yummy!,5.0,So good!! Not to hard and not to soft! They are perfect and so good!! A gift for Valentines. It was a huge hit with the group.
The product Wasn’t fresh broken pieces really not satisfied with the product,2.0,Dislike product.. Not fresh broken pieces overall not satisfied
Biscotti deserving of 5 stars!!,5.0,"This biscotti assortment was the perfect birthday gift. They were fresh and crisp! And, the choices pleased everyone."
Super fast shipping..wonderful biscotti,5.0,Birthday for my husband ..he Loves this biscotti...Thankyou
Variety,5.0,It was a gift but my family who received it loved them!
Much appreciated gift!,5.0,Sent these as a birthday gift for a family member with exacting tastes. She loved them and said they vanished in no time! That’s high praise in my book.
Not even close to what a biscotti should be. More like a cookie Extremely disappointing,1.0,Extremely disappointed!! Not even close to what a biscotti should be. I threw them away. Hundred
Great gift and delicious!!,5.0,"I bought these for my boyfriend as a little something extra for our anniversary. To say he loved them would be an understatement! He was impressed with all of the different flavors and it didnt take long for them to disappear (into his belly). They came in a nice box with a bow, and not a single one was broken. I recommend this as a gift for anyone who likes biscotti."
Delicious,5.0,Teste great! Not extremely sweet like other products.
Very Poor Quality,1.0,"These cookies were very stale and extremely poor quality. For the price, I was expecting exceptional quality. My kids and grandkids all took one bite and wanted no more...then, to top it off, I went to my Amazon webpage, expecting to be able to return the item, but was informed, ""this product unavailable for return."" All in all, a very disappointing purchase...and for Mothers Day, no less."
Very enjoyable gift,5.0,It was a gift for my daughter and her family. They enjoyed it very much. They tasted very good and fresh.
My mom loved the Biscotti!!,5.0,I have given this gift box a few times to my Mom. She just loves them!!
Wet and mushy biscotti ! Amazons response… tough.,1.0,"This Biscotti was mushy and wet ! Since crisp texture is really the best part of biscotti , it forces me to say that this is the worst biscotti I have ever tasted or tried unsuccessfully to swallow !"
Poor product😪,1.0,The photos were attractable but when arrived it was very dry and not tasty.very disapointing
Gift recipient loves them!,5.0,"Gave as a gift to a relative that loves to bake. He devoured them in a few days, claiming they were wonderful. He enjoyed the variety."
STALE,1.0,This is the worst I have ordered. Please don't waste your money on something like this. Mine went to the garbage.
Great 🎁,5.0,"I bought this as a birthday gift to a friend. My friend loves it, she said it was delicious. It arrived on time. I will surely recommend this to anyone and i’m gonna be a repeat customer."
Absolutely terrible.,1.0,This product had an expired date on it. The box was busted. The chocolates looked to be unbeatable. And the said it is not eligible for a return. Prety much sent me 40.00 worth of crap and told .e i had to keep it
Don't buy food especially chocolate online,3.0,Don't buy food especially chocolate online
A great Mothers day item,5.0,"My wife is does not have a very big sweet tooth, so I had to find an item that was not overly sweet or rich. She absolutely loves these biscotti, and the variety is amazing. Each one is unique, and each one is delicious. Definently going to be getting again, if not for a gift, then just to have as a snack or nice desert!"
Average biscotti not worth the high price,2.0,"Nonni's biscotti available at most supermarkets is a better tasting product at a much more favorable price. Other than the gift box presentation, there is nothing special about these biscotti."
These are tasteless.,2.0,The cookies are bland and all of them taste the same. I wouldn’t buy these again.
Good product,5.0,This was a gift for my daughter. She they where fresh and very good.
Excellent gift,5.0,I originally sent the 12 piece to my sister. She loved them so much I sent the 24 piece to her...
I buy these every Xmas!,5.0,"I buy these every year for Xmas and bdays. Ships fast and it's a great gift for those you have trouble shopping for! Tastes good, sometimes they're a little stale/hard but it's perfect with tea or coffee that it honestly doesn't bother me or the people I gift them to! Def buy these!"
Yummy !,5.0,Came in great shape - perfect gift for coffee lovers !
"As good as "" home-made""",5.0,"Being of Italian heritage I was leary of sending any Biscotti that wasn't ""home made"", but the timing for my Uncle's birthday was near and the reviews were encouraging so I took a chance. My Aunt called to say she could not believe how beautiful and delicious the biscotti were,and how happy my uncle was with the gift. ""Brava"" Barnett's...great product."
Chocolate all melted and absolutely flavorless,1.0,Supposed to be a gift
Great biscotti,5.0,"The biscotti is a very delicious, light, not too sweet wonderful cookie. I have received them as a gift and have given them as a gift. Everyone loves them!"
Wonderful gift,5.0,"Actually, this was bought as a gift and other than the “thank you” I have not heard how they liked them. I certainly looked like a wonderful gift. This is true for my situation too. One person did tell me they were delicious."
Just ok,3.0,"The package looked really pretty when it arrived. The presentation is perfect. I wish I could say the same about what was inside. The biscottis were just okay, definitely not worth the price. Mind you - there's nothing wrong with them. But I have had far better tasting biscottis at less tan half the price."
Presentation is great!,5.0,They are so good…
Good presentation.,3.0,Just too bland in taste.
Yummy Gift,5.0,It was a gift. My son and his family loved them!
Really hit the spot,5.0,I sent these biscotti to my brother and sister-in-law for their anniversary. The biscotti arrived on time and were delicious. This is the second time I sent these biscotti this year and they have been consistently superb.
Tasty!,5.0,Arrived fresh and beautifully packaged. One piece was broken but otherwise all intact and delicious. Sent as a gift and it was much appreciated.
Great tasting gift,5.0,No dislike on this item or the delivery…all good!
Ok,2.0,I didn’t like the biscuit. It seemed like it was made of shortbread. The biscotti I usually get are firmer so you can dip them in coffee.
Fresh and on time,5.0,It was a gift and was well received
Not recommended,2.0,The cookies came broken. They had very little taste. I had store bought biscotti that tasted better.
Good for sharing,5.0,Bought this for a second year in a row and the family loves it for a Christmas surprise. It’s a nice large size to share.
Worse than BAD!,1.0,"These biscotti were neither “ too soft” or “too hard”, they were simply INEDIBLE!!! Once bitten into, the entire cookie crumbled into a pile of fine sawdust! Unfortunately, this deplorable state permeated the entire box! I don’t know if the problem was due to a faulty batch, or if they were mishandled after shipping, but I do know it’s an expensive gamble to take, on an item that is NON- returnable!!"
Best biscotti I've ever tasted!,5.0,"Delicious! They are so flavorful, buttery, and has a nice crunch where you dont feel like your teeth will fall out. Best of all, they arrived quickly!"
Great gift idea!!!,5.0,"I got this for my wife for Mother's Day and she loved it. It came in a nice wrapped with a bow. I was worried about the delicacy of the product but Amazon did a great job of delivering it. Nothing was broken. But more importantly, the taste was outstanding. Will definitely purchase again."
To dry,2.0,"Presentation was impressive and a nice arrangement of the biscotti . But when you bit into it, it fell apart. Giving no chance to dunk into your coffee or tea. They were dry, I don't if they were stale or that's how they are to be."
Delicious,4.0,"Deliciousness? Oh yes! The best. Presentation? Oh no, .....don't gift. At least not if yours is shipped. Most were broken up."
Excellent!!!,5.0,Great for yourself or as a gift.
Great Gift,5.0,I was extremely happy with the Biscotti that we purchased. It was extremely fresh and was packaged great. I will use this company anytime I need to send out something special.
Beautifully delicious,5.0,Bought these as a gift for my 91 year old mother in law! She absolutely loved them!
Gift was a huge hit,5.0,My hubby ordered 8 of these and everyone who received this gift loved them! They said they tasted so good and were fresh.
Delicious,4.0,"The biscotti's arrived quickly, only one was broken, no big deal. Otherwise the packaging was inviting and the biscotti's are delicious."
This are fantastic,5.0,"Great presentation, great packaging, amazing taste. I will be getting more in the future. Highly recommend."
The quality and taste,5.0,I didn't get to have any myself but the people that did eat it loved the looks of it we're very impressed by The taste and the quality everybody loved it it was a huge hit at the company I appreciate it it was definitely worth the money thank you so much and I will be ordering again soon
Expect a few or more to be broken but great taste,4.0,Great taste but many were broken during shipment. I expected some of them to be broken upon arrival
Birthday sent in mail,5.0,Easy to send and my family member loved it.
"Top Notch Biscotti, The best i have had in quite some time",5.0,"This biscotti was incredible fresh, tasty and such a great variety, some of everything here, recommend to anyone who loves biscotti."
Barnetts Biscotti Cookies,5.0,This was an impulse purchase. What a pleasant surprise. The perfect late night snack with a cup of tea or coffee. Love them.
Simply the BEST,5.0,"I love biscotti but it is so hard to find really good flavorful biscotti that does not break your teeth!! I took a chance and sent to a friend who just raved, so I bought a box, arrived today and wow just wow, what great biscotti. Customer for life!!!!"
these are the worst bascotti in 50 years-sent me a new box and they are excellent THANKS,5.0,"The cookies were falling apart- As some from a family -had a few bascotti- it must have been from last years.
Terrible- tHEY REACTED AND RESOLVED IN A TIMELY MANNER THANKS"
They are very tasty,5.0,"So delicious! I ordered one box for a sister living in a different sttate and one for my household. That way she and I could both eat them with our coffee on Christmas morning, while we spoke on the phone together. It was my way of being with her. These biscotti were so good. And they are very decorative, too!"
So much better than anything you can buy at the grocery store!,5.0,"It was a gift for my birthday. I have made my own biscotti. It was very good, but I have to admit, Barnetts is even better!"
Won’t buy again.,2.0,I bought this for myself and a gift. Cookie crumbs everywhere covering the pieces. This is more of a cookie than a biscotti.
Yummy!,5.0,This was a gift and the recipients raved
Great Gift Biscotti,5.0,"Sent a box of these biscotti to both of our children. The gifts got rave reviews for taste, texture and freshness."
Biscotti Gift,5.0,I had it shipped to me and then sent it out as a gift. will be delivered this Friday 8/14 so can not review taste freshness. It was packaged very nicely
Thumbs Up,5.0,"Product arrived on time, big hit! Thanks!!"
Easy to send to long distance loved ones,5.0,"Super easy, he loved it"
Melted and broken,1.0,The items were broken and chocolate had melted onto other items.
Great gift for all ages.,5.0,"We sent five boxes as gifts and they were all well received. Great for dipping in coffee, tea or hot chocolate."
Like Being Back with Grandma,5.0,"What a memory! I received these for my birthday. What a treat. I sat down and had these alone with a cup of hot cocoa and it was like being back at the kitchen table with Grandma seventy years ago. She dunk biscotti in her coffee and me in my cocoa over stories about the ""old country"".Thanks for the memories."
ok not fresh,4.0,"I like the taste varieties, and nice package- but not fresh and many cookies were broken"
Delicious biscotti,5.0,"Our biscotti arrived fast, secure and fresh. I bought for a Father's Day gift. My husband loved all the different flavors. Amazing. Arrived in a very lovely box"
Beautiful presentation,4.0,Beautiful looking presentation but flavor was so so.
Good variety and tasty.,5.0,"Bought this as a gift for my wife and she really likes them all, there was not one that she did not like. I tried a couple of them and also liked them. The package came with a good variety of flavors so you do not get tired of them."
Many of the items arrived broken.,2.0,"Biscotti arrived in pieces. Shipping probably the cause. Items were ok, but I would not order again. Small in size."
Highly Recommended,5.0,I bought this for my Mom for her 80th birthday. She received the biscotti the next day and raved about how fresh and delicious they were. Highly recommend.
NOT BISCOTTI: false advertising,1.0,"I received Biscotti last night and was excited to try. Not biscotti, but non sweet, bland cookie. My husband and I were left with unpleasant taste we could not get rid of. Three hours later I had terrible nausea. I had to take sodium bicarbonate. We threw out the entire box of 24 biscotti because they were so bad. False advertising. My husband is from Italy and these were not biscotti by any stretch. I should get money back like I would if I purchased it in a store."
Fresh Biscotti in a Beautiful Box!,5.0,"Wow! The ""freshness"" of this product is amazing. I've placed 3 orders in 6 weeks and...not sharing.
Thank you, Adley! Delivery on ice worked & the chocolate biscotti was beautiful and so good."
Recipient loved them,5.0,The recipient loved the cookies. They are delicious. Delivery was right on time and packaging is attractive.
Superb biscotti,5.0,"Superb product!!! Bought this for my wife on Valentine’s Day (something a little less traditional than chocolate and flowers) and it was a hit!!!! The pastries are finely crafted...delicate, visually pleasing and, best of all, very tasty!!! My wife tells me I make very good biscotti but I’ll admit that these are better."
NOT AS NICE AS THE PHOTO,2.0,"The description sounds decadent. But the cookies are small, they crumble and don't stay whole and they are not secure enough for mailing. They came melted. They are like mini biscottis. Too much money for what they are."
Wouldn't really call them biscotti,2.0,The box and presentation was very nice however I would not call these true biscotti...Shortbread at best. 6 were broken on arrival and they easily break when you try to remove them from the box...
Awesome Gift!,5.0,"My sister stated they arrived in great shape & taste delicious!

Good Birthday & Valentine Gift!"
very good,5.0,quality
They're Okay,3.0,These are okay. I wasn't wowed by them. The packaging they come in is not conducive for storage and I don't care for many of the flavors. There were a couple that were quite tasty but $30 is a bit much (in my opinion) to spend for maybe 6 biscotti. I would say they'd be a nice teacher's gift but the packaging is thin and really flimsy.
Worth money and delicious,5.0,Worth money and delicious
Great gift to send,5.0,This was a gift I have delivered. It got RAVE reviews from the folks I sent it to
Thanks for letting me find this youmie 🍯 idem,5.0,Very very pleased 😀 will sertnely buy again
Not very good,2.0,"Bought as an anniversary gift for my in- laws. So... from looking at the picture and based on the cost, I was expecting these to be good. They weren't. They just didn't taste good. They look pretty and the presentation is nice, but that's all. Would not recommend."
Incredibly Tasteless,1.0,"If you know and love what biscotti are supposed to taste like, skip these and go to your local Italian bakery for your gift idea. These biscotti taste stale. I am confounded as to how the toppings can be so flavorless. I mean seriously, how did they make chocolate have no flavor? How do you even make peppermint that barely registers any taste? Other reviewers have said the same thing. Read the lower star reviews before you purchase.

Update - they did offer a refund after reading this review, so at least customer service is decent. I can't see how to answer their message to me, so maybe they will see this update. Thanks."
Delicious gift!,5.0,I gave these to my Dad this morning for Father’s Day and he couldn’t get over how delicious they smelled even though they were still wrapped. He loved them and will be enjoying them immensely. Turned out to be a great gift for the man that doesn’t really need anything.
Gift for my mom,5.0,My mom loves her gift.
These cookies were AWFUL!!,1.0,"Several of these were broken when they arrived, but I can understand how that could happen. However; 2 of the cookies did not have the other half. They were stale and tasteless. One of the flavors had a fishy taste. Horrible. They went into the garbage. Perhaps the company should review their quality control. It has occurred to me we may have gotten a bad box, but for that kind of money I am not willing to take a chance."
I would not purchase again,1.0,These are NOT biscotti. So i was very disappointed. They are biscotti-shaped cookies. Not worth the high price.
Excellent,5.0,"i have gifted these 3 times, all
to rave reviews. Especially good with coffee"
Birthday treat,5.0,I bought this as a Birthday treat for my Pastor and he absolutely loved it!! I'm going to purchase another one soon for myself! I recommend this treat for everyone! Yummy!!
My Folks Loved These,5.0,My folks that are basically shut in due to the COVID pandemic. They loved receiving these and ate them all rather quickly. They enjoyed them... :)
They are fresh,5.0,I love it ! My husband and I enjoy every single night with our coffee ! Delicate flavor .
Absolutely delicious,5.0,"What a great gift, they are fabulous and look so beautiful in the box as well as tasting good. Would highly recommend this product."
Disappointing texture and taste.,2.0,Disappointing texture and taste. Pretty box and ribbon but that is not enough to make up for pure product. Grocery store biscotti are superior.
Meh...,2.0,Bought these as a gift for my husband. Took us almost a month to finish them. Not the greatest.
A good gift for anyone .,4.0,Well package not one cookie broken beautiful presentation.
Really Appreciated by Recipients,5.0,"I gifted three different families plus my building manager with these biscotti, and all were
very pleased."
Excellent,5.0,"If you like Biscotti, you can't go wrong with this assortment. The box is beautifully packed with a very nice variety of Biscotti. It's perfect for both gifting or if you wish to indulge yourself. Overall, I cannot recommend it enough."
Very good as a gift. They loved them,5.0,"I used it for a gift because it is assorted and the packaging was very beautiful.
Thank you."
Cookie on bottom with candy on top,5.0,I bought this for my mother; she said they were great.
Nowhere near a biscotti!,2.0,They’re not awful but they’re nowhere near what a biscotti should taste like. The texture is all wrong. These are just cookies covered in chocolate! I ended up throwing away more than half the box.
Very good and nice present,4.0,Sent as a gift to my daughter and roommates who are in college. They said the biscotti were very good and arrived on time.
Excellent product,5.0,I bought this item to give as a Christmas gift. The biscotti are excellent and the container is also very nice to give as a gift. Sometimes biscotti can be dry and mealy. These were very tasty and were enjoyed by the staff. I would definitely buy this product again.
Not What I expected,2.0,"1. No description inside for what each bicuit is.
2. Definitely lacks tast and freshness."
Great product,5.0,This was a mother’s day gift - the presentation was beautiful and my mom loved it. She also liked that they were easy to chew! (Haha) my dad got to them after my mom and promptly ate the rest of the box - I know what I’m ordering for Father’s Day!
They were slightly melted. But the cookie was soft. No crunchy like a regular biscotti.,1.0,This was a gift for my sister.
Delightful,4.0,The texture was soft and delightful. It would be nice to have a plain biscotti included as well.
The flavor of these was very good; however,4.0,"My husband got these for me on Valentine's Day. The flavor of these was very good; however, I like mine a lot more crunchy."
Great gift,5.0,Very much a great gift idea...they were super fresh and delicious
NOT A Biscotti. Just a cookie.,1.0,"Very disappointed with my purchase of Barnetts Biscotti. I was expecting a Biscotti as advertised, but I got a box of very expensive cookies! Bought these as a gift for a friend who loves Biscotti and when we both sampled them, we were extremely disappointed. They are soft in texture, just like a cookie. Wish I could return, as I feel a little cheated. Don't normally write reviews unless I have something nice to say, but I felt compelled to write this one."
presentation was nice,3.0,Presentation nice
Perfect in every way!!!!,5.0,"Bought these as a Christmas gift for my sister who is VERY picky. She LOVED them!!!! Could not stop raving about how awesome they were!! Highly recommend anyone who likes a good biscotti buy these now!!!
Arrived as promised in an elegant box."
Very odd texture.,2.0,"Maybe the biscotti that I got were old, but the texture was very dry and powdery - almost like compressed sawdust. The toppings were fairly nice but my wife and I decided that the flavor and texture of the cookie part was so unappealing that the biscotti weren't worth the calories and we threw them out."
Gourmet Biscotti,5.0,"This was purchased to give to a family member who loves biscotti. The package came carefully packaged and with a beautiful bow. I initially was a little disappointed because the biscotti were actually pretty small, about half the size of what I expected. However, with the variety the package offered, the recipient of this gift loved it. The size was perfect as a small treat, and the variety made the gift appealing. The biscotti was fresh and delicious."
very good,5.0,very good
Great gift!,5.0,Given as a gift. Great for a coffee lover.
Delioso y buena calidad,5.0,"Fue agradable y le gustó a la familia
Bueno para regalar en ocasiones especiales"
Delicious variety pack!,5.0,"I ordered the biscotti pack for the Holidays. I loved the flavors and the biscotti was really nice, fresh and crumbly. I don’t like a biscotti too dry and hard so I really appreciated the texture. My Italian friend absolutely love them and couldn’t believe I found these on Amazon. I would definitely order these again for a special occasion. I must compliment the packaging as well with the golden paper tray and bow. It held up great all throughout the shipping process."
Cookies were bland and broken,1.0,Did not taste like biscotti at all!!
My daughter loves it,5.0,My daughter loves it
Delivered when promised.,4.0,"They were a gift for my Mother on Mother's day.
She was very pleased."
Delicious!,5.0,"Sent this as a gift and the people raved about it. Loved the flavors, the freshness and the presentation."
Delicious!,5.0,"The biscotti were wonderful. First of all, they look yummy and gorgeous in their packaging. Once you taste them you are not let down at all. They taste so good. You don't want to eat just one. I recommend Barnetts Biscotti for a nice gift or dessert for a party. They are great."
Two Thumbs Up!!!,5.0,"Amazingly these biscotti passed the taste test of the biggest ""PickyPuss"" I ever met....My Nephew!! One bite and his smile lit up, thumbs went up and even a ""Wow, these are really good...I think I'll try another."" flowed through his lips. I know where I'll be shopping for Christmas this year!!! THANKS"
Fabulous!,5.0,I have purchased these biscotti as gifts multiple times as everyone loves them.
A very popular gift for the holidays.,5.0,"This year I gave to most of my colleagues Barnetts Biscotti Cookies for the holidays. I received many positive compliments from my friends. Many of them will be looking forward to receiving their next gift of biscotti.
Great gift."
Fresh biscotti with a lovely presentation,5.0,"I bought Barnetts Fine Biscotti for my mom for Mother’s Day. I must tell you that she absolutely loved it. She said it was delicious (I could hear in her voice that she was being earnest), and she was impressed with the packaging. Thank you for delivering a quality - and tasty - product!"
VERY DISSAPOINTING!,2.0,was very dissapointing. Hardly any chocolate so hardly any taste. Cookie fell apart. Definitely not worth the price. The only positive was the packaging. That was very impressive.
Great gift,4.0,This was a gift
Fresh and delicious,5.0,"Very fresh, and the variety is wonderful. Such a beautiful gift, too. Very happy."
Expensive but not very tasty.,2.0,These are advertised as biscotti but they are more like a thick cookie. Definitely not good for dunking as they are too light. They're crushed candy topping was pretty but not what I am looking for with my coffee. I would not purchased again.
A gift well received!,5.0,"I sent these a condolence gesture, which was very much appreciated
for it's taste as well."
